{
  "schemaVersion": 1,
  "id": "M0-ARCHIVE",
  "milestone": 0,
  "status": "tested",
  "authority": {
    "archiveSha256": "e0bd2434a6b5005eee5e038c25f294d7ac0d497a3880f463f74266b53fa6bd5b",
    "executableSha256": "e2c33c73c42b14d56986e497ebcb38b7e431cddaec6fb143a647019c5c002b47",
    "levelSha256": "efaae10c309b266b6ad0c27369b9a4e227ae9d62b9aff6d5f8e076a535e83199"
  },
  "configId": "m0-reference-v1",
  "experiment": "Verify archive length and SHA-256 before opening it; enumerate the bounded central directory; extract only TOMB.EXE and LEVEL2.PHD beneath .work and hash the results.",
  "controls": [".gitignore contained .work/ before inspection", "Archive was not renamed, modified, recompressed, replaced, downloaded, or searched for elsewhere"],
  "observations": [
    { "status": "tested", "finding": "Archive is exactly 2194574 bytes and matches the frozen SHA-256." },
    { "status": "observed", "finding": "Required entries are tombraid/TOMB.EXE at 442247 bytes and tombraid/DATA/LEVEL2.PHD at 2873406 bytes." },
    { "status": "tested", "finding": "Extracted required entries match their ZIP lengths and frozen SHA-256 values." },
    { "status": "observed", "finding": "Archive README identifies the 1996 Core Design demo, a portion of level 2, VESA graphics, and the recorded keyboard controls." }
  ],
  "conclusion": "The sole authoritative archive and two required game inputs are frozen and locally available for bounded reference work.",
  "limits": ["No PHD semantics were inspected", "No public hosting source was selected or approved", "README distribution language does not approve a production endpoint"],
  "rawArtifacts": [".work/original/TR1PCdemo1.zip", ".work/extracted/tombraid/TOMB.EXE", ".work/extracted/tombraid/DATA/LEVEL2.PHD"],
  "downstreamTests": ["npm run gate:m0 archive identity and ZIP central-directory checks"]
}
